SL,USER NAME,COMMENT,label,Website
1,@edgarom1606,Worst opening in the history. We are being running by twisted people!!,negative,YouTube
2,@JM-bo7ko,It is garbage and France should be embarrassed by this show. Nothing but a ticking boxes event. You had a chance to make your country proud but turned it into a mess,negative,YouTube
3,@lucindar.8163,"The Olympics should be about sporting events. Not about religion, politics or gender identity.",negative,YouTube
4,@NoRiceToEat,As a Hindu I found this so disgusting to watch.,negative,YouTube
5,@IMCASSOC,"FRANCE should be ashamed.   What an embarrassment.  Absolutely terrible, whoever was responsible should be sacked..",negative,YouTube
6,@patricity9355,"Absolutely disgusting, France should be ashamed",negative,YouTube
7,@isabelnecessary9416,Some man in the show had his testicles poking out of his shorts and there was a child right in front of him  plus the blasphemous depiction of the Last Supper was absolutely vile.,negative,YouTube
8,@MichelleMartin-e2n,Absolutely disgusting! I will NOT be watching this trash.  What a shame for all those athletes who have worked so hard.  Not supporting NBC!,negative,YouTube
9,@TheBehm08, Disrespectful and absolute garbage  being read by an Indian woman is something I never knew I needed,negative,YouTube
10,@bogdanbirsasteanu2267,what the hell does sexuality have to do with an international sports event? i'm waiting for a rational answer !,negative,YouTube
11,@eduardfigoli,The opening of the Olympic Games in Paris was disgusting. I felt sick.,negative,YouTube
12,@GojiKong894,Straight blasphemy! I'd rather the olympics not exist at all than see this,negative,YouTube
13,@DebbieHall-q7t,"Horrific garbage, so disrespectful and inappropriate content for an athletic event, and families watching. Absolute CRAP!!! I refuse to watch a minute of the games. Not supporting woke NBC or France.",negative,YouTube
14,@FonzoTheTrucker,"This is the same group of people who say they want respect and to be included, but do some stupid mess like this. The olympics is garbage for allowing this!",negative,YouTube
15,@michaelevans756,This is a sad world we live in. Who thought this was ok?,negative,YouTube
16,@terrihahn731,They should be ashamed showing this disgraceful and disgusting portrayal of the last supper,negative,YouTube
17,@gauravexplore2,How pathetic to shame a religion like this,negative,YouTube
18,@rodri6095,What happens to France if they offends Muslims...,negative,YouTube
19,@iDuckman,"Agreed,  The worst opening ceremony I've seen over 15 Olympiads.",negative,YouTube
20,@PM-dg7cy,I am really sorry. I am French. We did not expect that kind of ceremony at all. It was horrible. I was with my children.,negative,YouTube
21,@alicerobb5924,"It was disrespectful, disgusting and showed nothing to do with the history of Olympics",negative,YouTube
22,@gillygil8747,I have watched the Olympics since 1968.  I am a lifelong athlete.  I will never watch the Olympics ever again.  Using One World ideology to attack Christianity is deplorable.  I AM DONE.,negative,YouTube
23,@fluxmuldar,The organizers must be scrambling to redesign the closing ceremony after all this backlash. I shudder to think what they had planned.,negative,YouTube
24,@lnl3237,Gratitude to all decent citizens of the world who have condemned this tasteless display of open bigotry.,negative,YouTube
25,@DavidKFZ,"This is one of the worst public mockings of a religion I've ever seen, I can't believe they thought it was ok to do this",negative,YouTube
26,@jimbojimbo6909,The worst opening in the History!!!!,negative,YouTube
27,@oslikoslikoff1261,And what about the beginning?- 3 children were invited by the death on the boat( In the beginning),negative,YouTube
28,@darionragland609,"They had four years to plan for this and this is what they gave us wow, I didn't watch it and I'm so glad I didn't what france",negative,YouTube
29,@lilianareyes9594,"Worst ever idea ever. The last supper ?
They can't even contribute fresh or creative ideas? They HAVE to insult people and be unoriginal? And we are supposed to celebrate them for what exactly???",negative,YouTube
30,@dct3588,What a shame. Worst opening ceremony ever.,negative,YouTube
31,@user-yf2hz7uy5m,The real depressing thing is this is what it took for people to realize the Olympics is twisted,negative,YouTube
32,@terraruins,"France hosting global event : "" oh yeah lets mock and insult a faith, that would be iNspIrAtIonAl""",negative,YouTube
33,@Nikitateagurl_77,It is disrespecful and irrelevant to the event.,negative,YouTube
34,@AmirMallouli-bm2wz,"As a Muslim, this is SO disguisting and blasphemy!!!",negative,YouTube
35,@rvykdhes,"For the first time in my 75 years, words escape me.",negative,YouTube
36,@helios4425,This was disgusting.  How is this allowed ? Who allowed it ? The people want answers and are out raged.,negative,YouTube
37,@liquid231,France should be BANNED for all events relating to the olympics. What is this horrendous show,negative,YouTube
38,@leslieannvanhumbeck7630,"I'm a Catholic, and that was a disgusting mockery of my faith.

It was also disgusting to mock Marie Antoinette. Her husband was killed. Her children were taken from her, and then she was beheaded.  Leave the poor woman alone.",negative,YouTube
39,@Dankbanana1,I'm from New Zealand and we have like 10 channels worth of Olympics. My dad and I won't be watching any of it. Full boycott,negative,YouTube
40,@zukazealanee,Keep in mind there is a CHILD at that table...,negative,YouTube
41,@suellaex,France had a big chance to show the world who they are..... but they decided to make it blasphemous...,negative,YouTube
42,@troythomason8032,They chose to use these games as an opportunity to mock the faith of over a fourth of the world's population.  I chose to boycott these games and they will not receive my support in any way.,negative,YouTube
43,@wasblind4835,"The devils playground is showing itself more and more. And people are playing along. The 144,000 is watching and we are sadden by what is going on.",negative,YouTube
44,@jasonk3605,"You know it's disgusting when even Muslims are decrying how anti-Christian it is.
The West has become a laughingstock.
Do not let your country be like us in the West.
Keep your country great.",negative,YouTube
45,@bergdada7311,"The shameful opening of the Olympics in Paris. The beggarly Paris disgraced itself with its Olympics not only with bedbugs, rats and cardboard beds, but also with the lack of food for the Olympians and guests! A complete failure and disgrace for France, which desecrated the Olympic Charter.",negative,YouTube
46,@epicfox567,Imagine being able to insult any religion at a world event? What if the Christian athletes? Then have the nerve to ban Russia on  moral  grounds. Disgusting,negative,YouTube
47,@jericchiang6615,I wonder if France's overall performance during the game was as careless and chaotic as in the opening ceremony.,negative,YouTube
48,@missjackjack,"saw this on instagram and i thought it was a meme, didnt know it was real! Feel so disgusted ",negative,YouTube
49,@alygon,"Due to this mockery, I and my family Will not be watching olympics at all.",negative,YouTube
50,@jillmizell2341,"This BS needs to be kept out of the Olympics and sports.  So was this part of the opening ceremony apparently put on  with no respect or regard to large amounts of people that wanted to watch the Olympics but you've comvinced otherwise worth it.  France, I think you have unnecessarily cut off your nose to spite your face!",negative,YouTube
51,@Sagemeister007,The opening ceremony was a disgrace and France Olympic Committee should be ashamed! Olympic is about uniting all countries and religion for sporting events.,negative,YouTube
52,@johnnysuh5337,"They keep on asking for acceptance and respect, but look at what they are doing. Disgusting!!!",negative,YouTube
53,@AnotherMartinez,The Olympics have turned into the event of people who have nothing to do with sports,negative,YouTube
54,@user-qi9bs6me3n,Shame on Paris!  Is this what France has become?  I will not be back!  It use to be a lovely place to visit.  You need new leadership.,negative,YouTube
55,@BringMeTheMonkeys,"If not a single athlete stands up against this blatant mockery, I think that'll be a clear sign that our society has truly fallen",negative,YouTube
56,@jacobkuntflapp,This is horrendous,negative,YouTube
57,@55wilddawn,"absolutely worse Olympic ceremony ever! what were we watching? The Oscars or the Olympics?? Red carpet, celebrities, Snoop Dogg for crying out loud??And to have the participants come in on boats instead of walking into an Olympic arena was pathetic. The French, who think they do EVERYTHING better, did it worse than I've seen",negative,YouTube
58,@Tonia-hv2le,The mockery and disrespect of Christ and Christians globally is outrageous and disgusting! I refuse to be a part of this satanic movement! All things are coming to fruition!,negative,YouTube
59,@LisaCunningham-id1vt,the most sick thing I had every watched. so much for family time TV shameful.,negative,YouTube
60,,The opening ceremony is a shame for France and this is the biggest stain in the history of the Olympics.,negative,YouTube
61,@cindeamulholland6338,"There are no Olympics for me this year.
Sacrilege!",negative,YouTube
62,@billyhue6313,"A disgraceful act, now wait for the consequences like it happened in Brazil.",negative,YouTube
63,@jeanghiberti9944,"The olympics has turned into such a cesspool, I won t be watching their  blasphemous circus and neither will  my family.",negative,YouTube
64,@dfausti66,"This is a bad look for France and its culture which was founded on Christianity! So much for the diversity and inclusion of Christianity in France! It is sad to see that the French have forgotten their roots and the foundations of their culture. As a Christian and one who is directly descended of the di Este family (Bourbon and Bonaparte families) who ruled France, I am absolutely embarrassed by such an event representing the Christian culture and heritage of France that I love and cherish depicted horrifically on the world stage. I would petition to remove the Paris organizing committee immediately!",negative,YouTube
65,@umarfarookchem,"Asians are more respectful of culture and traditions.
I still see Beijing Olympics opening ceremony as the best one. These western Olympics nation are nowhere near to Asians.",negative,YouTube
66,@sunnydeessa714,"I m a Spanish lesbian girl in my twenties, when I saw this with my family our hearts dropped. I cannot stand this sickness, I cannot with this anymore. Pure evilness to our children and population.",negative,YouTube
67,@TheAppifier,"The Olympic games are symbolic of international friendship, fraternity and the universal respect for positive human effort. It was bizarre to see an opening ceremony best characterized by the words ""laziness"" and ""spite"".",negative,YouTube
68,@gurnoorsingh4595,"""FRANCE""...you mean ""TRANCE""",negative,YouTube
69,@ryang7219,Im so glad as a Christian to know how many people even if they are not religious are offended by this,negative,YouTube
70,@Melissa-cb7wz,This breaks my heart. They ruined the Olympics. I miss sharing things that brought me such wholesome joy as a kid with my kids because everything has been perverted.,negative,YouTube
71,@RavenousFallen,Leonardo DaVinci is rolling over in his grave. His work was respectful of Christ and his disciples and he put in great effort to create that masterpiece just to be mocked by talentless buffoons exposing themselves at times.,negative,YouTube
72,@malevolentbishop7146,"Wasn't representing the last supper, was representing the feast of Dionysus, that comes from Greece, where the Olympics originated. The last supper painting was painted based on that feast. Hope this helps",negative,YouTube
73,@snugzyy,"i appreciate the indian news program seeing this and making a post for their nation, no post will be made in the usa, they will try and hide it and say it s nothing to worry about",negative,YouTube
74,@robertphair4285,Totally agree the red carpet scenes were absolutely disgusting.,negative,YouTube
75,@D4MI0N,0:59 Dudes chestnuts are hanging out over on the left....,negative,YouTube
76,@KD-gu2mb,I m not watching the Olympics because of this garbage,negative,YouTube
77,@voyager7,"The last supper skit was an open mockery of the Christian faith, and such a thing would never have been attempted by those in power of say, Islam, for example. I will not be watching one single second of the Olympic events.",negative,YouTube
78,@kas10163y,"Even if you throw out the mocking Christianity part, there was absolutely NO entertainment value to this and was disgusting on its own merits.  I hope the Olympics and NBC reap the bad Karma they are due for allowing this travesty.",negative,YouTube
79,@Jay-n262,This is what happens when the inmates run the asylum.,negative,YouTube
80,@nicoleworrick4012,This is extremely disrespectful,negative,YouTube
81,@armidafrankini3744,Garbage!  I won't ever watch the Olympics again unless there is an apology to Christians regarding the disrespect!,negative,YouTube
82,@MGWashington,never thought in my lifetime this would ever be the OLYMPICS ,negative,YouTube
83,@enderdude992,"I will pray for these people to open their eyes to this sinful world, amen",negative,YouTube
84,@b4astgn675,what does drag have to do with sports? that s two entirely different things.,negative,YouTube
85,@786Ronnie,What has olympics got to with religion.,negative,YouTube
86,@user-uo8kb5rv7n,"They were making a mockery of France...its culture, history and faith. They're doing the same thing to the US.",negative,YouTube
87,@karolclark791,"LGBTQ: ""we are normal people, we just want respect and to be treated well""
Also LGBTQ: ""and now we will make a mockery out of the world's biggest religion"".

Im a few weeks they'll be trying to understanding why people are mean to them.",negative,YouTube
88,@jake6899,This makes me sick,negative,YouTube
89,@rajendrathakur7,"if it mocked a particular religion, there would have been riots.",negative,YouTube
90,@zacharylee6405,The point of an opening ceremony is to show the culture of the country that is hosting it. That was a just a mockery of everything about France and its history.,negative,YouTube
91,@edsalvador5939,This is so bad. Why would they do this?,negative,YouTube
92,@walterfoyt5985,"The opening ceremony was great.  There was no attempt to mock Christianity.  The part that you referring to was not the last supper.  It was depiction of an Ancient Greek Bacchanal, which you might know if you read anything but the Bible, which is nothing but a collection of Jewish folklore.",negative,YouTube
93,@terry768,Shame on you Paris/France....,negative,YouTube
94,@mthig2203,"Absolutely disgusting, was looking forward to watching the olympics, but now it will not be on my tv. A complete embarrassment to the human race",negative,YouTube
95,@zomgoose,"""May the Odds Be Ever in Your Favor""",negative,YouTube
96,@dinarobert3463,"For our struggle is not against flesh and blood, but against the rulers, against the authorities, against the powers of this dark world and against the spiritual forces of evil in the heavenly realms.",negative,YouTube
97,@velarde1303,The ceremony was absolutely disgusting and disgraceful,negative,YouTube
98,@fooooo3,What a TRASH opening ceremony þ,negative,YouTube
99,@jiminverness,"Some parts were good: The rings on the Eiffel Tower, the barges down the Seine rather than walking on the track; but yeah, a lot of it was rubbish.",negative,YouTube
100,@gildagarcia2730,"Diabolic, disrespectful, shameful, disgusting and none related to such important sports event like the Olympics.
What a twisted mind who organized this awful opening!!
Celine Dion was the only highlight of the event. Her comeback & spectacular performance, welcome back Celineþ",negative,YouTube
101,@stevenschuster,Absolutely shocking. Disgusting. To included a child with the rest of the performers disgracing the Last Supper was beyond perverse.,negative,YouTube
102,@IzzyChopChop,"I'm not French, nor have I have lived there, but I don't think that drag culture is really a prominent thing in Paris, let alone in Paris. I thought the opening ceremony is suppose to showcase French culture..but how is drag French culture?! It's not",negative,YouTube
103,@CHICKENRAN34,"What a disgusting mess, also why the guy kn the left got his balls hanging out hell no ",negative,YouTube
104,@kea.68,"I'm a french catholic, usually open-minded but this time... I feel shame.",negative,YouTube
105,@gordoncarr9747,"Yes, it is the worst and the most insulting.  Just a group of narcissists exercising their disorder.",negative,YouTube
106,@amyrivera9992,"What a disgrace extremely disrespectful, they have ruined it!",negative,YouTube
107,@langbo9999,The worst thing is the support of people with unhealthy interest in kids.,negative,YouTube
108,@angelaperry2907,What a disgusting mess ,negative,YouTube
109,@trunkmonkey355,"When I heard Lady Gaga was performing, I knew it would be something sick.",negative,YouTube
110,@user-xu6dj9fp9b,I'll never watch the Olympics again! Period.,negative,YouTube
111,@silvcrest,"The performance of Céline Dion singing Édith Piafs "" l'hymne à l'amour"" was absolutely great. Who dares to call this garbage ?",negative,YouTube
112,@Cry4Tanelorn,I am so disgusted. They should be ashamed of themselves,negative,YouTube
113,@annmiller319,The ceremonies help me decide on a further trip to France Not going to happen never ever. Why would I ever travel to France to go against my moral reliefs? I m a Christian s first and foremost. Disrespectful,negative,YouTube
114,@formicapple2,Absolute rubbish.  I wonder how many millions were wasted on that event.,negative,YouTube
115,@---777---,"2012: Hunger Games
2024: Olympics opening ceremony",negative,YouTube
116,@jazzjazzy5063,I m not even religious but this was lame trash&  it literally didn t even have anything to do with anything sports related,negative,YouTube
117,@user-dj4qf7oh2f,Go woke Go broke.  I'm boycotting this crap.,negative,YouTube
118,@LeoBjorn18,The weirdest and most confusing Olympic opening ceremonies of all time.,negative,YouTube
119,@trob1173,Why has the opening ceremony been turned into a Super Bowl half-time show? It's absurdity like this that has turned me away from sports.,negative,YouTube
120,@Littlewing1977,"It was  garbage to many agnostic & atheists as well.  Had zero to do with athletes, competition & the spirit of the Olympic games which is bringing the world closer together through shared ideals such as aspiring for excellence & rewarding excellence",negative,YouTube
121,@tomcampbell8934,Never forget: this is the type of content that made YouTube disable to dislike number. We are the majority,negative,YouTube
122,@builderdog3875,Is that Certified Baddie?! ,negative,YouTube
123,@robinbabcock4620,"Had no intention of watching the Olympics, this just sealed the deal",negative,YouTube
124,@anastasia-fr1gn,Thank you Indian news for being the only ones really talking about this. Western media is not talking about it at all. It was so weird and a really bad way to represent their country.,negative,YouTube
125,@cirrusstar8187,Never again im watching the Olympics,negative,YouTube
126,@samjones6304,"Disrespectful, that's not what the Olympics are all about.",negative,YouTube
127,@deadskunk8733,This totally mocks all of the hard work that all of the Olympians have trained for their whole lives. It s totally sickening.,negative,YouTube
128,@user-om8ql8wv5i,Shame on them for mocking the Last Supper!  The most disgusting opening ever!!,negative,YouTube
129,@MafiaSicilian,"Thanks God, Russia have no part of this shit",negative,YouTube
130,@roozbeh6999,"Another day , Another pattern left by the "" tribe """,negative,YouTube
131,@cdre.9652,THE OLYMPIC 2024 CEREMONY IS ABSOLUTE TRASH,negative,YouTube
132,@awdobsession717,Disregard for their own host country s respect with millions watching around the world. Terrible,negative,YouTube
133,@chaya8122,"Inamissible and disgusting, there is nothing sacred for this people! Shame on them!",negative,YouTube
134,@boysrus61,This was disgusting.,negative,YouTube
135,@TRECTADACTYL,"Don't let your city bid for the ""privilege"" of hosting this humiliation ritual.",negative,YouTube
136,@anezgrasp3845,"Disgusting and unnecessary. Mock Jesus all you want, god will have the last laugh.",negative,YouTube
137,@Lee-bh6tb,I'm glad ppl finally opened their eyes,negative,YouTube
138,@s.w.warbirds4126, Dark stain : The day the world turned on the Olympic Games,negative,YouTube
139,@manuelcepeda4834,"as an adult it was ofensive,embarrasing the type of world we are living in.",negative,YouTube
140,@jennypucci7118,"Absolutely disgusting what is wrong with people, this has nothing to do with athletics and everything to do with perverse ideology",negative,YouTube
141,@wadeunderhile7977,I will never watch the Olympics ever again.,negative,YouTube
142,@lovemybunch336,Disrespectful and disgusting&  So sad what is being shoved down our throats. No Olympics for me this year.,negative,YouTube
143,@crazeekids9744,"When someone shows you who they are, believe them.",negative,YouTube
144,@user-wt3el9gd7j,"My heart breaks when I see what has become of once the greatest civilization ever. Ignorance, no taste, no respect, no creative forces. I feel sorry for Europe. Please wake up if you can.",negative,YouTube
145,@khaos9973,I m a Greek pagan and this beyond the most disgusting and disrespectful thing ive seen,negative,YouTube
146,@r.o5865,The painter of the last supper Leonardo Da Vinci was a bad man ,negative,YouTube
147,@maynesputchapatchesxd6631,Who allowed all of this garbage to be spewed into our eyes,negative,YouTube
148,@derekp.7831,That would have to be a woke liberal group of people that did this garbage.,negative,YouTube
149,@geraldtama2050,"Remember they used to call other people's savages before, look at them now worse than savage.",negative,YouTube
150,@mqb5151,I feel like this narrator is about to ask me for my credit card details,negative,YouTube
151,@jimmymoore2758,How did they think this up and think no one would have a problem,negative,YouTube
152,@user_whatdoesitmatter,This act openly mocks Christianity. I am appalled!! Absolutely disgusting!!,negative,YouTube
153,@julientchuente2045,"I am french and we are very shocked about this ceremony. Paris is not different than babylon or Sodome, I will move soon.",negative,YouTube
154,@user-gv2tw7de3m,Did anyone enjoy the ceremony? Surely not the entire world was 'outraged'.,negative,YouTube
155,@michaelangelo9119,Who approved this?  We need to pray for them.,negative,YouTube
156,@riyesa911,Worst opening ceremony ever,negative,YouTube
157,@talonfive7938,This has to be the Worst Olympic Opening Ceremony in History of the Olympics.,negative,YouTube
158,@hithere6701,"I am so disappointed!! I was looking forward to sharing this once every four years event with my kids but thankfully i watched it first! I will not be showing this to my children, it's highly inappropriate and why so much sexual stuff? The throuple scene?? wth?? It was terrible in every way!",negative,YouTube
159,@vikeng21,Stunned at what i was looking at. There was no meaning to the antics. Biggest Joke of an event.,negative,YouTube
160,@fourtoes412,The level of glamorization of vulgarity that passed as the Paris Olympics opening ceremony surpassed my most pessimistic expectations.,negative,YouTube
161,@mifunebrevar,0:59  there's something hanging that sticks out,negative,YouTube
162,@charliedallachie3539,There was just absolutely no reason for them to do that& . Why even touch anything religion& so many other things they could have done,negative,YouTube
163,@anjinaidu1185,This will remain forever as a Worst Opening Ceremony of Olympics ..,negative,YouTube
164,@Dwade689,Worst opening ever in Olympic history,negative,YouTube
165,@silvcrest,I found it quite respectful to show and celebrate french founder of the modern Olympic Games : Pierre de Coubertin,negative,YouTube
166,@EskoTeroPetteri,As a Finnish person i have to say im embarrased about our president's reaction to the opening seremony. Totally a freak show.,negative,YouTube
167,@Nekavandre,"I'm not religious at all. But even I wouldn't have done something like this. This is just bad taste and people that are religious have every right to feel offended. This was by no means cool, unique, quirky, respectful, or anything. This was shortsighted, immature, not cool, and spitting on a significant event in the religious world.",negative,YouTube
168,@coleirick6220,Absolutely the worst!! Disrespectful!! I can t believe they did this!! This will be the first time in my life I will not watch the Olympics! What is this world coming to?,negative,YouTube
169,@newhampshirelifestyle4233,"I have no time for the olympics, I am busy returning library books.",negative,YouTube
170,@Nimbus849,"They'll let this run but God forbid, you take one PED and get caught.",negative,YouTube
171,@amydunn4062,This is horrible!,negative,YouTube
172,@stephenwarrington9719,I think we are in for something crazy to happen.,negative,YouTube
173,@anujkumardas227,Proud to be INDIAN with Tradition ,negative,YouTube
174,@thegavatron3978,"This is truly disgusting, disgraceful, and truly offensive",negative,YouTube
175,@sabyfernandes7072,France ..  what a shame..,negative,YouTube
176,@RudyBusted,Its a sign of the times we are living in. What a time to be alive!!!!!!!!,negative,YouTube
177,@user-hz5jl9hx9z,and you wonder why France is collapsing??,negative,YouTube
