SL,USER NAME,COMMENT,label,Website
2572,@beautifulnature4964,Thank you for having Cambodain artist,Positive,YouTube
2573,@AhmedAdel-ox1nz,Thank you Paris  to France from Egypt 🇪🇬 and Saudi Arabia 🇸🇦,Positive,YouTube
2574,@EthelJung-j5w,Easily the most beautiful games I’ve seen on TV. The Paris backdrop was spectacular,Positive,YouTube
2575,@rahulkadyan1618,"I feel emotional wow its the greatest show of talent on earth we will miss it for 4 years
Love form india 🇮🇳🇮🇳",Positive,YouTube
2576,@angieexotic556,Thank you Paris So proud of our athletes from Ethiopia 🇪🇹 ,Positive,YouTube
2577,@Arya1509,Absolutely spectacular... Thank You paris.. Love from India !! 🇮🇳,Positive,YouTube
2578,@comentadoraification,"I dont want to go back to politics and stuff  I want the Olympic Games to last for ever, i want to keep on watching people being happy and celebrating life together ",Positive,YouTube
2579,@user-np8oe5bu7e,Thank you paris from uzbekistan,Neutral,YouTube
2580,@KostasSpanos-zi5eq,THANK YOU SO MUCH FRANCE THAT YOU PAID TRIBUTE TO A GREAT COUNTRY GREECE!RESPECT TO GREEK AND FRENCH THAT ALWAYS SHARE THE SHAME VALUES,Positive,YouTube
2581,@laurindaCon,The Olympics always feel like a dream while they're happening. Closing ceremonies are bittersweet.,Positive,YouTube
2582,@jawadreddho1068,"This was the first Olympics I have watched vividly, and I loved every moment of it. It was a great occasion to enjoy with my family. Thank you Paris, lots of love from Bangladesh! 🇧🇩",Positive,YouTube
2583,@memoriesmoments4551,Congratulations to you ALL AWESOME.,Positive,YouTube
2584,@ddr8993,"Paris indeed courageously did it in her own way... and it was beautiful 🇨🇵


edit: Bark all you want Antoinettes ",Positive,YouTube
2585,@juniortulo3823,Thank you Paris for two weeks of excitements...Congratulations.,Positive,YouTube
2586,@3films501,Thank you from Uzbekistan 🇺🇿,Positive,YouTube
2587,@patandrews4760,"Thankyou Paris France for your magnificent country and your beautiful city your hospitality and imagination, you were exceptional! US is going to find it hard to beat this spectacular event . love from N.Z  ",Positive,YouTube
2588,@gauravgohain300,"I feel sad about the closure because for the past few days I was high on adrenaline rush watching participants sweat it out for medals,some were nail biting contests.thank u olympics for inspiring us to be sports lover forever .It is undoubtedly the greatest show on earth.thank you Paris..",Positive,YouTube
2589,@Mo-sy6jx,"The most spectacular Olympic since the 2008,the best so far thank you Paris and France",Positive,YouTube
2590,@dianavrieze5236,"Love France , the language , the culture, Thank You Paris",Positive,YouTube
2591,@user-rj4xd5ov1n,Thanks france from Indonesia ,Positive,YouTube
2592,@allspig,Thank you Paris! It was one of the most beautiful Olympic Games I've seen,Positive,YouTube
2593,@tengkumahashar4400,Thank you France. From MALAYSIA ,Positive,YouTube
2594,@syedasamia6803,Thank you Paris to provide such a great platform to the world...love from pakistan 🇵🇰,Positive,YouTube
2595,@lintangguh,"Thank you Paris, from Indonesia. We got two gold medals and very proud of our athletes...",Positive,YouTube
2596,@izzasigo,"The most majestic, artistic, wonderful, energetic, peaceful, highly organised , and joyful Olympic Games of all times. BRAVO PARIS et Thank You beaucoup a toutes et tous.Vive la Olympics 2024 , VIVE la France.",Positive,YouTube
2597,@igorricardo33,"Thank you, Paris! From Brazil! 🇧🇷",Positive,YouTube
2598,@nicolasdufour7133,"I was there and I can tell you that it was absolutely incredible, I have never experienced such emotion in my entire life. It was grandiose, enormous, magical. Thank you all",Positive,YouTube
2599,@Aman-sz6db,"Thank you Paris 2024
Beautiful Olympics games
Kazakhstan 🇰🇿 ",Positive,YouTube
2600,@thewizard5060,"Thanks Paris from Tenom, Sabah, Malaysia <3",Positive,YouTube
2601,@ntombingobeni6098,".. thank you Paris 2024️.. .. colourful tracks.... the lights

..the fans... marvellous and non stop .... thanks very much..
 ️ off from Mzansi 🇿🇦🇿🇦",Positive,YouTube
2602,@TALKIES-m8v,One of the most popular olympic games..,Positive,YouTube
2603,@user-gc4qy9ui4f,This has got to be the most watched Olympics,Positive,YouTube
2604,@visual-philippines,Thank Paris from the Philippines 🇵🇭,Positive,YouTube
2605,@tobiwan001,"I think they were the most amazing olympics that I can remember.  An opening ceremony on the Seine was bold, memorable and unique. The venues were amazing, beautiful and historic. The Grand Palais, Les Invalides, riding in Versailles, Beach Volleyball below the Eiffel tower, surfing in Tahiti, etc. To me it was the gold standard of the Olympic Games.",Positive,YouTube
2606,@anandkishore3898,"Most emotional event I've watched in my life, for me
Just in a week, it has made Indians to be connected to every Indian sports, and from 28th July onwards, I totally immersed myself to watch & love other sports, which I was always interested in, but was very reluctant to follow due to cricket

This Paris Olympics 2024 has moulded the real sports lover in me, I have given up the 25 year watched cricket forever, to give justice to all other sports we Indians have totally sidelined since 1980s till date.
JAI HO to all other sports in India 🇮🇳  ",Positive,YouTube
2607,@rob18rams,"Brilliant closing ceremony, well done France.",Positive,YouTube
2608,@sam-dx1br,What a feeling! Thank you France. We must keep this traditional!,Positive,YouTube
2609,@TheHomelessDuck4,THE KING OF KINGS WILL JUDGE YOU!,Positive,YouTube
2610,@virnowi,"Pity, doesn't include the masked torch bearer and the armored knight's stage on, such a pleasure to see them again!! I will miss them",Positive,YouTube
2611,@b3tres,"Maraming salamat, Paris! It was a memorable event for the Philippines 🇵🇭, we had 2 golds and 2 bronzes!!! Thank You!!!",Positive,YouTube
2612,@ForzzaItalliaaa,France had the best olympics ever from italy !!!,Positive,YouTube
2613,@user-xi8qx9hs1u,Thank you  Parisfrom Japan🇯🇵,Positive,YouTube
2614,@Sakithma,Thanks Paris from Srilanka🇱🇰,Positive,YouTube
2615,@swethasundram5264,Thank You paris  !!! such an amazing performance from an athlete for 11 days unforgettable moments in each days  Thank you paris .... See you in LA 2028 🇺🇲with a great start ,Positive,YouTube
2616,@ruchipatrol,Thank you France ... quels beaux Jeux Olympiques !!,Positive,YouTube
2617,@ammarameen9004,From 🇮🇶 Iraq  best closing ceremony ever  Thanks Paris ,Positive,YouTube
2618,@leondego8445,"Best Olympics I saw in my life, THANK YOU PARIS",Positive,YouTube
2619,@user-fs6pq6ec2y,Watching from festival town Lagos Nigeria ,Positive,YouTube
2620,@DanielEun,Not having Kobe as part of the handover to LA hurts,Positive,YouTube
2621,@sandylating6642,Thx Paris France Love from Indonesia,Neutral,YouTube
2622,@kamaurahamukti5919,"we are all part of the family of human beings
Thank You, Paris ",Positive,YouTube
2623,@ryanmercado4892,ngl.. this is one of the best closing ceremonies of all time,Positive,YouTube
2624,@user-ti9sl8if1y,"Paris thanks itself by saying ""Thank You Paris"".",Positive,YouTube
2625,@bonifacekimutai2635,"Thank You Paris, from Kenya with love.",Positive,YouTube
2626,@mayankverma19921,Biggest and grandest Festival of world is Olympics,Positive,YouTube
2627,@VanDungTran-qg6ur,Thx Paris 2024. I was hooked to my phone for the last two weeks watching all the games . ,Positive,YouTube
2628,@Vaanya_ASO,Thank you Paris  It was one of the most beautiful Olympic Games I've seen..Love From India 🇮🇳,Positive,YouTube
2629,@mahimadeka8639,Long live the true spirit of the Olympics and the great sportsmanship. Love from India 🇮🇳️,Positive,YouTube
2630,@serbaserbivivo6030,"Thanks, volunteers ! you have helped organizing this event well.

-",Positive,YouTube
2631,@zamiraakbarova7373,"Well done, Paris!!! Love from the UK",Positive,YouTube
2632,@radeks.6367,Thank you Paris from Czech Republic 🇨🇿,Positive,YouTube
2633,@yuva-raja,"Most Memorable..... ever... thnk you All  ... ""All for one , One for All""",Positive,YouTube
2634,@f3vermore,congrats everyone who participated in the paris 2024 olympics ️️️️️️️️️️️️️️️️️️️🇫🇷🇫🇷,Positive,YouTube
2635,@pramodhrathnasekara5985,"perfect ending and a perfect start for the next one , much love to each and every one who made this possible !!",Positive,YouTube
2636,@Killbotfactory,I wanna be at the olympic games one day. Congratulations for this great intercontinental event. ,Positive,YouTube
2637,@melaniemaculada927,Thank You Paris So Proud of our 2 Gold medals Caloy from the Philippines Thank You️️,Positive,YouTube
2638,@fghfgu2778,"Tahniah Paris,France dari Malaysia ",Positive,YouTube
2639,@janehollowaycrossland9474,Bravo Paris! Thank You ! 🇨🇦,Positive,YouTube
2640,@sara8614,Thank You Paris! The energy during these games was magnifique!,Positive,YouTube
2641,@greeksinmars,It is Great owner to create Olympic Games for any nation. Thank you Greece and thank you FRANCE ... Bravo,Positive,YouTube
2642,@ΧρήστοςΠαράσχος,"Thank you Paris
From Greece 🇬🇷 ",Positive,YouTube
2643,@nidi2377,"These Olympics were absolutely amazing: locations, organisation, safety, and paris is such a beautiful city ",Positive,YouTube
2644,@leahluostarinen,Thank you Parisfrom Canada🇨🇦 I really enjoyed watching it with my mom and dad alot but I'm disappointed that it's done now,Positive,YouTube
2645,@juliafarrugia5092,"Thank you PARIS  OLYMPIC 2024,PILIPINA watching from Malta,Europe.
Proud For Philippines Deligation Carlos Yulo Win 2Gold Medals//Gymnast Sport",Positive,YouTube
2646,@magicrtrip5492,"Thank You Paris et a tous les athletes vous nous avez fait vibrer pendant deux semaines
Amazing olympics",Positive,YouTube
2647,@VeronikaTvrdaComposer,"The firework was magnificent. Still, I will remember Tokyo closing ceremony better, for that beautiful arrange of Clair de Lune from Claude Debussy while the olympic fire was being extinguished. Such a tribute to France, I was crying...",Positive,YouTube
2648,@thetrickster4526,I'm feeling nostalgic already. We'll always have Paris.,Positive,YouTube
2649,@jacquelinerichardson5809,Wow!!  Classy beautiful closing ceremony !  Thank you France from Australia,Positive,YouTube
2650,@melodytomlinson9329,What a spectacular end to an incredible Olympics. I loved the way Paris show cased itself. How awesome for athletes to perform in such iconic places. Next level!,Positive,YouTube
2651,@RoniSubartoo,Thank you Paris. From Indonesia 🇮🇩,Positive,YouTube
2652,@amar6688,"Hello from Brunei!
Thank You, Paris, France!",Positive,YouTube
2653,@jeanoltt,"Congrats to Leon Marchand who walked the entire 8,5km distance between Louvre and the stadium, always winning",Neutral,YouTube
2654,@rcm8881,"Great hosting France this Olympics will be memorable to us Filipinos. Thank You. 🇵🇭,🇫🇷",Positive,YouTube
2655,@rosesalim406,Thank You Paris from Vietnam ,Positive,YouTube
2656,@chrisLawnsey,Difficult to even come close to the beauty of Paris venues and the passion of the french crowd! I was at the fencing in the Grand Palais and went to see the cycling in Montmartre and these were unreal moments. Never seen anything like it. Thank You PARIS!,Positive,YouTube
2657,@ritchenacibron,It had me a goosebump in the last part what a beautiful voice.,Positive,YouTube
2658,@victorgoes4368,Did anyone else notice Justice blasting off the speakers during the athletes' entrance parade? Kudos to the DJs!,Positive,YouTube
2659,@arafathfathima-bs6ce,Thank you paris  . Love from sri lanka 🇱🇰   🇨🇵,Positive,YouTube
2660,@lis_adm9321,One of the worst closing ceremony ever,Positive,YouTube
2661,@user-zx2xi9sb3y,Thank you Paris from  Russia.,Negative,YouTube
2662,@instant-happiness1404,Amazing closing event🇫🇷🇫🇷🇫🇷! Greetings from 🇲🇽🇲🇽🇲🇽,Positive,YouTube
2663,@newgeneration8390,"I watched many games from Afghanistan 🇦🇫. Thanks sports for all joys you are offering to humanity.  Amongst all bad news coming from every part of the globe, Olympic Games were satisfying and maintaining hopes for a better future.",Positive,YouTube
2664,@kristianraesaura815,North Korean experienced a non-fake chants and claps ,Positive,YouTube
2665,@anasshahid224,"Great closing ceremony. The Paris Olympics were really entertaining, thank you to the organizers for putting on an incredible event ",Negative,YouTube
2666,@yanim7278,"Wow,wonderful moment! Give me goosebumps.  Thank you Paris🇫🇷 from Canada 🇨🇦 Congratulations to all the wonderful and great Athletes and participants from all over the world and respect to every single person who was part of this Beautiful and exciting games. Long Live Olympics  Long Live Peace ",Positive,YouTube
2667,@mensah-oklefiovaleria1123,"Thank you paris, awesome closing ceremony  congratulations to everyone too, love from Ghana 🇬🇭",Positive,YouTube
2668,@juju-wc5kb,It could have been better ,Positive,YouTube
2669,@Troubadourdelavie,"Bravo ,Thank You France",Negative,YouTube
2670,@rob-time,This was a unique games.  I wish the world could be this united every day.,Positive,YouTube
2671,@juniorbayanimonzon6410,It's amazing the closing ceremony  we salute to you ! From Philipines ,Positive,YouTube
2672,@zootopian07,"People, Athlets, visitors, volunteers, security guardians, from all over the world, we are already missing You  Olympic Spirit and Peace and Love !",Positive,YouTube
2673,@AlexPeter-ee4gb,The best Olympiques by far. You can’t beat Paris as the backdrop for such amazing event! ,Positive,YouTube
2674,@nuwansameera6759,Thanks Paris from Sri Lanka,Positive,YouTube
2675,@valeriegauthier6997,Worse event ever,Negative,YouTube
2676,@ramziqafarov,"It was the best Olympics in my life, thank you France 🇫🇷 ",Positive,YouTube
2677,@1964munna,"What a memorable show!!!! Missing you Paris. I wish it went on for a few more days!!!!
Love from India.",Positive,YouTube
2678,@valentincharpentier842,Even comments section has turned to peaceful mode ,Positive,YouTube
2679,@Random_Brother99,Next time we will come back stronger...!! ,Positive,YouTube
2680,@Gurpreet007able,Thanks Paris from India,Positive,YouTube
2681,@mauricejrbalansag1827,Thank you PARIS amazing closing ceremony,Positive,YouTube
2682,@jdjfifwhha,Thanks your fransiya Uzbekistan ️️,Positive,YouTube
2683,@ewad8727,Stunning  Being in Paris to watch the Olympic Games felt like pure magic  Vive la France! 🇫🇷,Positive,YouTube
2684,@robbiereilly,"From Tokyo with Love, Thank you, Paris.  ~ LA it's your show now. Make us proud! ",Positive,YouTube
2685,@PingpongAddict,Thanks Paris.. from Pingpong Addict Indonesia 🇲🇨,Positive,YouTube
2686,@user-rg3rv5cy1i,What an event beautiful,Positive,YouTube
2687,@sosaabraham9359,Congratulations France! 🇫🇷 Love you Paris! From India.,Positive,YouTube
2688,@photological,"Bravo Paris, Thank You France! 🇫🇷",Positive,YouTube
2689,@sweatiepie,Thank You France for having vannda in the closing ceremony ,Positive,YouTube
2690,@EstherAnarfiMinkah,Beautiful and Eclectic ending. See y'all in LA28 🇺🇲🇺🇲🇺🇲🇺🇲,Positive,YouTube
2691,@ferryfernando5193,Bad event,Negative,YouTube
2692,@safari0317,"thank you Paris the summer olympic  games 2024
all athletes volunteers  you guys are so fantastic!!",Positive,YouTube
2693,@micsypars,"Congratulations to All!
And most especially to My Beloved Country, The Philippines 🇵🇭
Bringing home 2 Golds and 2 Bronze..
Mabuhay!
And Thank You Paris! ",Positive,YouTube
2694,@khanndara,Congratulations Olympic Game Paris 2024  from Cambodia 🇰🇭,Positive,YouTube
2695,@yolandagofigure,So beautiful Pairs 🇫🇷. Congratulations to all the  winners and to those who did not win a metal you're all still winners. ️.. what an emotional ceremony.,Positive,YouTube
2696,@jacobcherian4251,Thank You Paris 🇫🇷 Love from India!,Positive,YouTube
2697,@alvinlch1668,️Thank You Paris🇨🇵 love from Malaysia 🇲🇾,Positive,YouTube
2698,@zh9652,20:28 pure insanely perfect beautiful breathtaking performance from yseult ,Positive,YouTube
2699,@iamlavkush_,"This year's Olympics were so great to watch. So many world records made. Enjoyed every bit of it. Especially the Athletics.
Thanks from India 🇮🇳️",Positive,YouTube
2700,@lenemauala2810,"So far the best host excellent games, congrats France.",Positive,YouTube
2701,@elenakarmiri8021,Best Olympics ever thank you Paris 🇨🇵,Positive,YouTube
2702,@simpingfornene9821,Thank you Paris from Cambodia,Positive,YouTube
2703,@MicheleDummi,The my way song at the end gave me goosebumps. Thank You Paris  See you all in LA2028,Positive,YouTube
2704,@mstrrandelealcoranarcilla538,Thank you for 2024 Paris Olympics and among the Victory of the Philippine Athletes on three for given four medals including Carlos Yulo is a First Filipino Double Gold Medalist. ,Positive,YouTube
2705,@122501lya,when you're french and watching it in english because these wasn't a compact version in french ,Neutral,YouTube
2706,@martinakhaleeli8847,"Paris Olympics!! Just a fabulous opening, a wonderful 2 weeks...you guys aced it - at 62 years I have seen quite a few! You guys win hands down..The opening was just unbelievable, really. Je t'aime , je t'aime ",Positive,YouTube
2707,@kaventseu7375,Art!!! The vocalist and the fireworks in sync!! Only a country with strong artistic sense can do this without skipping a beat. Just like the climax of Celine Dion singing in the opening... amazing!!,Positive,YouTube
2708,@OmnoWombo,"Honestly, I'm sad it's over. These Olympics were such a blast!",Positive,YouTube
2709,@drmiguel3299,I was here and I’m not going to forget it,Positive,YouTube
2710,@ayomidejoseph_,Thank you Paris and the Olympics committee. I really enjoyed the event even though my country Nigeria didn't win any medals. Congratulations to all the participants and medalists. Love you all 🇳🇬,Positive,YouTube
2711,@user-hv5cl9pf4t,"Thank You Paris,France! Love and peace forever!",Positive,YouTube
2712,@user-je8sx9qw4w,Thanks Paris from Indonesian,Positive,YouTube
2713,@lockhead-ky7sl,Best Closing Ceremony Ever !!,Positive,YouTube
2714,@sosaabraham9359,Thank You Paris for making this Olympic event a memorable one!   from India.,Positive,YouTube
2715,@babyguilhem9338,First time we see a metal band  perform at the olympics and it was fire,Positive,YouTube
2716,@muhibbhussain2262,Thanks for one of the wildest Olympics . With records broken across the board,Positive,YouTube
2717,@milanik529,Thanks Great France🇫🇷 ️u are well done️,Positive,YouTube
2718,@robertglennienz,Thanks Paris! Thank You and au revoir! Arohanui from Aotearoa New Zealand! ,Positive,YouTube
2719,@user-ec5yu5en4z,Great work Paris….outstanding arrangements,Positive,YouTube
2720,@charlenegraveline2637,This was a great recap video of the highlights..including the hand-off of the flame in L.A.,Positive,YouTube
2721,@Mr_Jingles111,Being on the podium during the closing ceremony is beyond spectacular. What a best way to receive your medal!,Positive,YouTube
2722,@drick2480,"This Olympics was a great spectacle from start to finish. So many memorable sporting moments, beautiful city and surroundings, truly a marvel. Thank You beaucoup Paris.",Positive,YouTube
2723,@josiebvh6525,Where are the singer (Benjamin Bernheim) and pianist??? That was the best part of the closing in my opinion! The only part that was actually a show.,Positive,YouTube
2724,@mhayantonio1766,Thank you paris...as young generation watching this looking forward for another Olympics ,Positive,YouTube
2725,@Orchidee503,Amazing city Paris  Greetings from Germany 🇩🇪,Positive,YouTube
2726,@JohnCope79,"Thank you, France, for a beautiful festival, your gigantic enthusiasm and the highly emotional moments, from your friends in Germany.",Positive,YouTube
2727,@osinachiuwaechia2198,Thank you Paris from England 🇬🇧,Positive,YouTube
2728,@effkay3691,Easily the most beautiful games I’ve seen on TV. The Paris backdrop was spectacular,Positive,YouTube
2729,@VanDungTran-qg6ur,Thx Paris 2024. I was hooked to my phone for the last two weeks watching all the games . ,Positive,YouTube
2730,@JessicaGould-z9l,"Congrats to Leon Marchand who walked the entire 8,5km distance between Louvre and the stadium, always winning",Positive,YouTube
2731,@JonNRabz,Thanks Paris from The Philippines,Positive,YouTube
2732,@aliciachrystal2901,Way better than Rio !,Neutral,YouTube
2733,@highlight-q,Thank You Paris Olympic Games From Cambodia 🇰🇭  🇫🇷,Positive,YouTube
2734,@qsstwotravellers2425,"Thanks Paris . Greetings from Canada.
Will see Paris in Autumn.",Positive,YouTube
2735,@SachiraBhanu,Thank you France for your contribution toward this game.,Positive,YouTube
2736,@fiestaclement8186,Congratulations Paris you did a great job 🇫🇷🫶🫶🫶️️️,Positive,YouTube
2737,@cisacirsa8968,"

Thankyou Paris
From Indonesia ",Positive,YouTube
2738,@saideep3047,"TBH, this is the best Olympics I've ever seen. The vibe is unmatched, and the Eiffel Tower made for a stunning background. This truly is the greatest sporting event on the planet. Thank you, Paris, France. Until 2028...LA!",Positive,YouTube
2739,@akashmegla5094,"Congratulation France Olympic 2024
Form Bangladesh",Positive,YouTube
2740,@geosef5329,Thank You Paris! Thank You France! I was in a  part of the opening ceremony of Athens 2004.. .. I remember the feelings during the closing ceremony of 2004 (Athens)! Bittersweet... didn't want to let go of those amazing feelings!  Greece France 2004 - 2024.,Positive,YouTube
2741,@michaeltepaurel2257,"Goodbye Paris🇫🇷, will see you in Los Angeles🇺🇸.",Positive,YouTube
2742,@Legendary4me,"Paris 2024 was greater than even everything I expected. From Celine  to the beach volley in front of the Eiffel Tower, and the horsing competition at Versailles, Cycling at Montmartre and so much more. And My Way to end it up. Stunning.",Positive,YouTube
2743,@sisaynigussie,"THANK YOU PARIS FROM ETHIOPIA. Paris to LA, 2028. WAITING 2028 IN LA.",Positive,YouTube
2744,@EntS480,The Olympic committee banned Russia but didn’t ban Israel.  Is it a Justice?,Positive,YouTube
2745,@thanhnguyenchi3076,Thank you from Vietnam,Positive,YouTube
2746,@MckeyPark,Hope next L.A. Olympic make world happier!,Positive,YouTube
2747,@MrMwaaaaaa,"one of the conclusions of these Olympic games: to have lived two weeks without politicians, without political debates was a suspended time. we don't need you! Again……congratulations Paris  ",Neutral,YouTube
2748,@Goldenwave60,Thank from Paris 🇮🇳,Positive,YouTube
2749,@BruceWillisUA," It's so sad that we say goodbye to the Olympic Games and have to go back to normal life .Thank you for everything, Paris-2024 🇨🇵 ! And we are waiting for Los Angeles-2028 🇺🇲 !",Positive,YouTube
2750,@Karmer,"The games were incredible and a huge thank you for the energy the volunteers and staff and everyone involved brought. I love that the whole city was part of the Olympic spirit, and we could see the flame for the first time without having to enter an Olympic Village. Best Olympics ever.",Positive,YouTube
2751,@allaboutcristiano,thank you Paris! from Pakistan 🇵🇰,Positive,YouTube
2752,@clementemergence,What a show ! Thank you all ! Proud to be an earthling 🫶️,Positive,YouTube
2753,@warsamenur4895,respect from somalia 🇸🇴,Positive,YouTube
2754,@EITiga,Thank You Paris 🇫🇷... Welcome Los Angeles 🇺🇸,Positive,YouTube
2755,@WHITNEYBRASIL," Look at Yseult's voice, it looks like an angel, the note goes up flawlessly, it's so beautiful, what an extraordinary vision, a great revelation in music, I'd never seen her before, I thought she was incredible, congratulations, that ending was spine-chilling",Positive,YouTube
2756,@Abbatobia,The Statue of Liberty given to USA once again from France.,Positive,YouTube
2757,@Dragon-kt8lz,"Thank you for all athetes from all over the world.
especially thankts to  all Korean teams,  so proud of you all.",Positive,YouTube
2758,@ahmedkarieh8102,I already miss the Olympic game greeting all from Djibouti 🇩🇯,Positive,YouTube
2759,@kidpuri8589, one of favourite moments of all time ,Positive,YouTube
2760,@bzetu101,The World Record for the worst Opening and Closing Ceremony ,Negative,YouTube
2761,@Ivybelle50,Thank you Paris for the past couple weeks. I enjoyed everything from the stunning and innovative opening ceremony to the beautiful closing. You've set the bar high for LA!,Positive,YouTube
2762,@RUXSORFM_RADIOSI,Thank you Paris for all. From Uzbekistan,Positive,YouTube
2763,@nicolasbutten7112,"Thanks to the Olympic Games, we happily forgot about wars for two weeks.",Positive,YouTube
2764,@dylan6550,"The Red Hot Chili Peppers, Billie Eilish, and Snoop Doggy Dogg have all become capital dogs.",Neutral,YouTube
2765,@luvyou-baby,"It was my first time that I watched the Olympics, it had interesting moments, and gave me and my family a way to bond and have fun conversations. They did a great job hostting.  I'm looking forward to the USA to host them, hope they could top this year. Wishing them the best. congrats to all the winners and those who got to play there",Positive,YouTube
2766,@hollygoelightly,Most creative and interesting Olympic ceremonies I have ever witnessed in my 63 years.,Positive,YouTube
2767,@gp1237,"This is what France is, in all its colours. From the opening ceremony to the closing. Every part is representative of it's people. Be unapologetically flawed, that is the beauty in all of us.",Positive,YouTube
